{
  "bundle_version": 1,
  "bundle_id": "bnd-syn-0010-2774bd",
  "host_id": "host-5262238f",
  "sandbox_name": "talent-intake-orchestrator",
  "collected_at": "2026-09-09T10:45:10Z",
  "rule_pack_version": 15,
  "inputs_attempted": {
    "runtime": {
      "attempted": true,
      "reached": true,
      "window_seconds": 1320
    },
    "image": {
      "attempted": true,
      "reached": true
    },
    "manifest": {
      "attempted": true,
      "reached": true
    },
    "repo": {
      "attempted": true,
      "reached": true
    }
  },
  "attributes": {
    "deployment": {
      "value": null,
      "status": "ABSENT",
      "tier": "declared",
      "method": "no key of the set in container environment or labels"
    },
    "image_digest": {
      "value": "sha256:2f149198adececca3db1d125917181c7d543dcdb98e716504c479c2bc2b1faa3",
      "status": "ANSWERED",
      "tier": "observed",
      "authored_by": "none"
    },
    "harness_identity": {
      "value": "openclaw/1.8.2",
      "status": "ANSWERED",
      "tier": "declared",
      "authored_by": "subject",
      "method": "image labels + package manifest"
    },
    "framework_identity": {
      "value": "langgraph/0.2.61",
      "status": "ANSWERED",
      "tier": "declared",
      "authored_by": "subject",
      "method": "package manifest"
    },
    "model_name": {
      "value": "mistral-large-2407",
      "status": "ANSWERED",
      "tier": "observed",
      "authored_by": "none"
    },
    "inference_endpoint": {
      "value": "http://llm-gw.hr-automation-prod.svc:8080/v1",
      "status": "ANSWERED",
      "tier": "observed",
      "authored_by": "none"
    },
    "mcp_servers_declared": {
      "value": null,
      "status": "BLIND",
      "tier": "declared",
      "reason": "GATEWAY_MANAGED",
      "note": "empty because the gateway holds the list, NOT because there are none. Lower bound is >= 1, not 0."
    },
    "mcp_servers_observed": {
      "value": [
        {
          "endpoint": "mcp-gw.internal:7443",
          "sessions": 6,
          "transport": "http"
        }
      ],
      "status": "PARTIAL",
      "tier": "observed",
      "authored_by": "none",
      "reason": "GATEWAY_MANAGED",
      "note": "sessions to the gateway; upstream servers are not distinguishable"
    },
    "tool_names": {
      "value": [
        "hr.attribution.assign_interviewer"
      ],
      "status": "PARTIAL",
      "tier": "observed",
      "authored_by": "none",
      "method": "JSON-RPC frames seen during a 1320s window",
      "note": "floor, not a count; tools not exercised in the window are absent here"
    },
    "tool_capability_envelope": {
      "value": null,
      "status": "BLIND",
      "tier": "declared",
      "reason": "NOT_COLLECTED_BY_PACK",
      "note": "nothing produces it yet"
    },
    "declared_destinations": {
      "value": null,
      "status": "BLIND",
      "tier": "declared",
      "reason": "GATEWAY_MANAGED"
    },
    "observed_destinations": {
      "value": [
        {
          "host": "sso.corp.acme.io",
          "tls": true,
          "peer_guess": "data_service"
        },
        {
          "host": "recruiter-db.internal",
          "tls": true,
          "peer_guess": "data_service"
        },
        {
          "host": "cal-sync.east-1.aws",
          "tls": true,
          "peer_guess": "external"
        },
        {
          "host": "llm-gw.hr-automation-prod.svc",
          "tls": false,
          "peer_guess": "data_service"
        }
      ],
      "status": "ANSWERED",
      "tier": "observed",
      "authored_by": "none"
    },
    "undeclared_destinations": {
      "value": null,
      "status": "BLIND",
      "tier": "declared",
      "reason": "GATEWAY_MANAGED",
      "note": "NOT COMPUTABLE: declared side is blind"
    },
    "credential_inventory": {
      "value": [
        {
          "name": "GW_CLIENT_CERT",
          "class": "mount",
          "type": "mtls",
          "shape": "pem",
          "sha256": "46a8…"
        }
      ],
      "status": "ANSWERED",
      "tier": "observed",
      "authored_by": "none",
      "note": "gateway-fronted: the agent holds one gateway credential; upstream credentials sit in the gateway"
    },
    "credential_provenance": {
      "value": {
        "GW_CLIENT_CERT": "injected"
      },
      "status": "ANSWERED",
      "tier": "observed",
      "authored_by": "none",
      "method": "image layers diffed against runtime env"
    },
    "in_layer_deleted_secrets": {
      "value": null,
      "status": "ABSENT",
      "tier": "observed",
      "reason": "SOURCE_OK_NOT_PRESENT",
      "method": "walked every image layer for deleted secret files"
    },
    "mounts": {
      "value": null,
      "status": "ABSENT",
      "tier": "observed",
      "method": "container inspect: no bind or volume mounts"
    },
    "workdir": {
      "value": "/app/agent-workspace",
      "status": "ANSWERED",
      "tier": "observed",
      "authored_by": "none"
    },
    "user": {
      "value": "agent",
      "status": "ANSWERED",
      "tier": "observed",
      "authored_by": "none"
    },
    "permissions": {
      "value": {
        "privileged": false,
        "caps": [
          "SYS_ADMIN"
        ],
        "root_fs": "read-write"
      },
      "status": "ANSWERED",
      "tier": "declared",
      "authored_by": "platform",
      "method": "pod securityContext, read from the cluster API"
    },
    "approval_policy": {
      "value": null,
      "status": "BLIND",
      "tier": "declared",
      "reason": "GATEWAY_MANAGED",
      "note": "absence is NOT evidence of restriction; assume no approval gate"
    },
    "tool_allow_deny": {
      "value": null,
      "status": "BLIND",
      "tier": "declared",
      "reason": "GATEWAY_MANAGED"
    },
    "sandbox_network_policy": {
      "value": "default: allow all egress",
      "status": "ANSWERED",
      "tier": "observed",
      "authored_by": "none",
      "method": "container network mode"
    },
    "system_prompt_present": {
      "value": true,
      "status": "ANSWERED",
      "tier": "observed",
      "authored_by": "subject",
      "note": "presence only"
    },
    "system_prompt_text": {
      "value": null,
      "status": "BLIND",
      "tier": "observed",
      "reason": "NOT_COLLECTED_BY_PACK"
    },
    "skills_inventory": {
      "value": [
        {
          "name": "resume-parsing",
          "description": "Extracts structured candidate data from PDF and DOCX resumes using heuristics tuned for our legacy ATS format.",
          "source_type": "skills_config",
          "destination_endpoints": []
        },
        {
          "name": "slot-matching",
          "description": "Negotiates interview windows by cross-referencing hiring manager availability against the global calendar service.",
          "source_type": "skills_config",
          "destination_endpoints": [
            "cal-sync.east-1.aws"
          ]
        },
        {
          "name": "compliance-flagging",
          "description": "Marks applications requiring manual legal review based on location-based data protection rules defined in the policy matrix.",
          "source_type": "skills_config",
          "destination_endpoints": [
            "sso.corp.acme.io"
          ]
        }
      ],
      "status": "ANSWERED",
      "tier": "declared",
      "authored_by": "subject",
      "method": "SKILL.md frontmatter; skills constructed in code are not visible"
    }
  }
}